{
  "$schema": "https://json-schema.org/draft/2020-12/schema",
  "$id": "https://getmaipai.github.io/shared/spec/schemas/likeness-consent.schema.json",
  "title": "LikenessConsent",
  "description": "LIKENESS-01. One change to a household adult's consent about their own likeness, appended each time the person switches one of the two consent settings (likeness.adults, likeness.adult_content) on or off. The settings hold the current value; this record is the history: who agreed to what, and when. Only the person themselves writes it, from their own settings, and only an adult. Records are never edited or deleted.",
  "type": "object",
  "additionalProperties": false,
  "required": ["id", "person_id", "option", "state", "source", "changed_at", "created_at", "updated_at", "hlc"],
  "properties": {
    "id": { "type": "string", "minLength": 1 },
    "person_id": { "type": "string", "minLength": 1, "description": "The person whose likeness this is (the subject), who made the change." },
    "option": {
      "type": "string",
      "enum": ["adults", "adult_content"],
      "description": "adults: other adults here may make pictures, videos and styles that look like this person. adult_content: and may include adult content (only meaningful while adults is on)."
    },
    "state": { "type": "string", "enum": ["on", "off"] },
    "source": { "type": "string", "enum": ["settings"], "description": "How the change was made; this is the record provenance. Only the person's own settings page writes it." },
    "changed_at": { "type": "string", "format": "date-time" },
    "created_at": { "type": "string", "format": "date-time" },
    "updated_at": { "type": "string", "format": "date-time" },
    "hlc": { "type": "string", "pattern": "^[0-9]+:[0-9]+:[a-z0-9]{6,}$", "description": "Hybrid logical clock: wall_ms:counter:node (7.3)." }
  }
}
