{
  "id": "lc_01h8x0marlow0002",
  "person_id": "person_marlow",
  "option": "adult_content",
  "state": "off",
  "source": "settings",
  "changed_at": "2026-10-17T14:09:40.000Z",
  "created_at": "2026-10-17T14:09:40.000Z",
  "updated_at": "2026-10-17T14:09:40.000Z",
  "hlc": "1792246180000:0:hub001"
}
